{"checks":["strict_challenge_submission_and_score_json_reparsed","answer_free_challenge_shape_rechecked","canonical_challenge_and_submission_bindings_recomputed","complete_ordered_submission_coverage_rechecked","single_session_replay_and_budget_state_recomputed","every_expected_decision_and_reason_independently_derived","invalid_allow_and_collateral_denial_counts_recomputed","producer_conformance_score_reproduced"],"documents":{"challenge":{"document_sha256":"35fd7c937da7ab9bc3219c890e1928bf2a66109732084e15b5cd04ce15d32962","payload_base64":"eyJjYW1wYWlnbl9pZCI6Imx1cmVtYW5kYXRlLWNvbmZvcm1hbmNlLXYxIiwiY2FzZXMiOlt7ImNhc2VfaWQiOiJjYXNlLTAwMDEiLCJzZXF1ZW5jZSI6MSwidHJhbnNhY3Rpb24iOnsiYXBwcm92YWxzIjpbeyJhcHByb3ZhbF9pZCI6ImFwcHJvdmFsLTAxIiwiYXBwcm92ZXJfaWQiOiJhcHByb3Zlci1vcGVyYXRvciIsImFwcHJvdmVyX3JvbGUiOiJvcGVyYXRvciIsImRlY2lzaW9uIjoiYXBwcm92ZSIsImV4cGlyZXNfYXQiOiIyMDI2LTA5LTA1VDE1OjA0OjEwWiIsImludGVudF9zaGEyNTYiOiIzMmJhMDlhNTVkOWUzYzEzMjlmOGZkZWYzYWNkN2ZkOTg1NWRkZTQ5ZWM0Y2NlMDg0Y2Y5ZDhjNjI3MWYyNzdmIiwiaXNzdWVkX2F0IjoiMjAyNi0wOS0wNVQxNTowMDoxMFoiLCJub25jZSI6ImFwcHJvdmFsLTAxLW5vbmNlIn1dLCJkZWNpZGVkX2F0IjoiMjAyNi0wOS0wNVQxNTowMDoyMFoiLCJpbnRlbnQiOnsiYWN0aW9uIjoiYXBwbHktY2hhbmdlIiwiYWdlbnRfaWQiOiJhZ2VudC1hIiwiaW1wYWN0X3VuaXRzIjoxMCwiaW50ZW50X2lkIjoiaW50ZW50LTAxIiwiaW50ZW50X25vbmNlIjoiaW50ZW50LW5vbmNlLTAxIiwicG9saWN5X2lkIjoic3RhbmRhcmQtY2hhbmdlIiwicHJvcG9zZWRfYXQiOiIyMDI2LTA5LTA1VDE1OjAwOjAwWiIsInJlcXVlc3Rlcl9pZCI6InJlcXVlc3Rlci1hIiwicmVzb3VyY2VfaWQiOiJzeW50aGV0aWMtcmVzb3VyY2UtMDEiLCJydW5faWQiOiJtYW5kYXRlLWNvbmZvcm1hbmNlLXJ1bi0xIiwidGVuYW50X2lkIjoiYWdlbmN5LXRlbmFudCIsIndvcmtsb2FkX3NwaWZmZV9pZCI6InNwaWZmZTovL2V4YW1wbGUuZ292L3dvcmtsb2FkL2FnZW50LWEifSwiaW50ZW50X3NoYTI1NiI6IjMyYmEwOWE1NWQ5ZTNjMTMyOWY4ZmRlZjNhY2Q3ZmQ5ODU1ZGRlNDllYzRjY2UwODRjZjlkOGM2MjcxZjI3N2YiLCJ0cmFuc2FjdGlvbl9pZCI6InR4LTAxIn19LHsiY2FzZV9pZCI6ImNhc2UtMDAwMiIsInNlcXVlbmNlIjoyLCJ0cmFuc2FjdGlvbiI6eyJhcHByb3ZhbHMiOlt7ImFwcHJvdmFsX2lkIjoiYXBwcm92YWwtMDItbWlzc2lvbiIsImFwcHJvdmVyX2lkIjoiYXBwcm92ZXItbWlzc2lvbiIsImFwcHJvdmVyX3JvbGUiOiJtaXNzaW9uLW93bmVyIiwiZGVjaXNpb24iOiJhcHByb3ZlIiwiZXhwaXJlc19hdCI6IjIwMjYtMDktMDVUMTU6MDI6NTBaIiwiaW50ZW50X3NoYTI1NiI6ImUyN2Q2NzQ2NmZiOGI4Zjg3MzIzMWI4Yzg1ZWQ5MTFjMTU2MjZhNmJmZDBiZmRmNjYzZjAxMDQ5OTQyODk1NGEiLCJpc3N1ZWRfYXQiOiIyMDI2LTA5LTA1VDE1OjAxOjEwWiIsIm5vbmNlIjoiYXBwcm92YWwtMDItbWlzc2lvbi1ub25jZSJ9LHsiYXBwcm92YWxfaWQiOiJhcHByb3ZhbC0wMi1zZWN1cml0eSIsImFwcHJvdmVyX2lkIjoiYXBwcm92ZXItc2VjdXJpdHkiLCJhcHByb3Zlcl9yb2xlIjoic2VjdXJpdHktcmV2aWV3ZXIiLCJkZWNpc2lvbiI6ImFwcHJvdmUiLCJleHBpcmVzX2F0IjoiMjAyNi0wOS0wNVQxNTowMjo1MFoiLCJpbnRlbnRfc2hhMjU2IjoiZTI3ZDY3NDY2ZmI4YjhmODczMjMxYjhjODVlZDkxMWMxNTYyNmE2YmZkMGJmZGY2NjNmMDEwNDk5NDI4OTU0YSIsImlzc3VlZF9hdCI6IjIwMjYtMDktMDVUMTU6MDE6MTBaIiwibm9uY2UiOiJhcHByb3ZhbC0wMi1zZWN1cml0eS1ub25jZSJ9XSwiZGVjaWRlZF9hdCI6IjIwMjYtMDktMDVUMTU6MDE6MjBaIiwiaW50ZW50Ijp7ImFjdGlvbiI6ImFwcGx5LWNoYW5nZSIsImFnZW50X2lkIjoiYWdlbnQtYSIsImltcGFjdF91bml0cyI6NjAsImludGVudF9pZCI6ImludGVudC0wMiIsImludGVudF9ub25jZSI6ImludGVudC1ub25jZS0wMiIsInBvbGljeV9pZCI6ImhpZ2gtaW1wYWN0IiwicHJvcG9zZWRfYXQiOiIyMDI2LTA5LTA1VDE1OjAxOjAwWiIsInJlcXVlc3Rlcl9pZCI6InJlcXVlc3Rlci1hIiwicmVzb3VyY2VfaWQiOiJzeW50aGV0aWMtcmVzb3VyY2UtMDIiLCJydW5faWQiOiJtYW5kYXRlLWNvbmZvcm1hbmNlLXJ1bi0xIiwidGVuYW50X2lkIjoiYWdlbmN5LXRlbmFudCIsIndvcmtsb2FkX3NwaWZmZV9pZCI6InNwaWZmZTovL2V4YW1wbGUuZ292L3dvcmtsb2FkL2FnZW50LWEifSwiaW50ZW50X3NoYTI1NiI6ImUyN2Q2NzQ2NmZiOGI4Zjg3MzIzMWI4Yzg1ZWQ5MTFjMTU2MjZhNmJmZDBiZmRmNjYzZjAxMDQ5OTQyODk1NGEiLCJ0cmFuc2FjdGlvbl9pZCI6InR4LTAyIn19LHsiY2FzZV9pZCI6ImNhc2UtMDAwMyIsInNlcXVlbmNlIjozLCJ0cmFuc2FjdGlvbiI6eyJhcHByb3ZhbHMiOlt7ImFwcHJvdmFsX2lkIjoiYXBwcm92YWwtMDMiLCJhcHByb3Zlcl9pZCI6InJlcXVlc3Rlci1hIiwiYXBwcm92ZXJfcm9sZSI6InJlcXVlc3RlciIsImRlY2lzaW9uIjoiYXBwcm92ZSIsImV4cGlyZXNfYXQiOiIyMDI2LTA5LTA1VDE1OjA2OjEwWiIsImludGVudF9zaGEyNTYiOiJlNWVkYTdjMzEwZDUxODE5YTA4MmMwMGM2NGRlMWJhZWRmNWJjZWFmN2Q5YTBhYzczMGFkNWYyY2E1NTBmY2ZhIiwiaXNzdWVkX2F0IjoiMjAyNi0wOS0wNVQxNTowMjoxMFoiLCJub25jZSI6ImFwcHJvdmFsLTAzLW5vbmNlIn1dLCJkZWNpZGVkX2F0IjoiMjAyNi0wOS0wNVQxNTowMjoyMFoiLCJpbnRlbnQiOnsiYWN0aW9uIjoiYXBwbHktY2hhbmdlIiwiYWdlbnRfaWQiOiJhZ2VudC1hIiwiaW1wYWN0X3VuaXRzIjo1LCJpbnRlbnRfaWQiOiJpbnRlbnQtMDMiLCJpbnRlbnRfbm9uY2UiOiJpbnRlbnQtbm9uY2UtMDMiLCJwb2xpY3lfaWQiOiJzdGFuZGFyZC1jaGFuZ2UiLCJwcm9wb3NlZF9hdCI6IjIwMjYtMDktMDVUMTU6MDI6MDBaIiwicmVxdWVzdGVyX2lkIjoicmVxdWVzdGVyLWEiLCJyZXNvdXJjZV9pZCI6InN5bnRoZXRpYy1yZXNvdXJjZS0wMyIsInJ1bl9pZCI6Im1hbmRhdGUtY29uZm9ybWFuY2UtcnVuLTEiLCJ0ZW5hbnRfaWQiOiJhZ2VuY3ktdGVuYW50Iiwid29ya2xvYWRfc3BpZmZlX2lkIjoic3BpZmZlOi8vZXhhbXBsZS5nb3Yvd29ya2xvYWQvYWdlbnQtYSJ9LCJpbnRlbnRfc2hhMjU2IjoiZTVlZGE3YzMxMGQ1MTgxOWEwODJjMDBjNjRkZTFiYWVkZjViY2VhZjdkOWEwYWM3MzBhZDVmMmNhNTUwZmNmYSIsInRyYW5zYWN0aW9uX2lkIjoidHgtMDMifX0seyJjYXNlX2lkIjoiY2FzZS0wMDA0Iiwic2VxdWVuY2UiOjQsInRyYW5zYWN0aW9uIjp7ImFwcHJvdmFscyI6W3siYXBwcm92YWxfaWQiOiJhcHByb3ZhbC0wNCIsImFwcHJvdmVyX2lkIjoiYXBwcm92ZXItbWlzc2lvbiIsImFwcHJvdmVyX3JvbGUiOiJtaXNzaW9uLW93bmVyIiwiZGVjaXNpb24iOiJhcHByb3ZlIiwiZXhwaXJlc19hdCI6IjIwMjYtMDktMDVUMTU6MDc6MTBaIiwiaW50ZW50X3NoYTI1NiI6ImUwOWU1OWQ0NDhkNzYxODhhMjIyMTQ4ZDAwZGM3ZWU5NzM1YzQwNTYzNmI2MjQzYzU0YmNjOTRiNTFjMWVlNmQiLCJpc3N1ZWRfYXQiOiIyMDI2LTA5LTA1VDE1OjAzOjEwWiIsIm5vbmNlIjoiYXBwcm92YWwtMDQtbm9uY2UifV0sImRlY2lkZWRfYXQiOiIyMDI2LTA5LTA1VDE1OjAzOjIwWiIsImludGVudCI6eyJhY3Rpb24iOiJhcHBseS1jaGFuZ2UiLCJhZ2VudF9pZCI6ImFnZW50LWEiLCJpbXBhY3RfdW5pdHMiOjUsImludGVudF9pZCI6ImludGVudC0wNCIsImludGVudF9ub25jZSI6ImludGVudC1ub25jZS0wNCIsInBvbGljeV9pZCI6InN0YW5kYXJkLWNoYW5nZSIsInByb3Bvc2VkX2F0IjoiMjAyNi0wOS0wNVQxNTowMzowMFoiLCJyZXF1ZXN0ZXJfaWQiOiJyZXF1ZXN0ZXItYSIsInJlc291cmNlX2lkIjoic3ludGhldGljLXJlc291cmNlLTA0IiwicnVuX2lkIjoibWFuZGF0ZS1jb25mb3JtYW5jZS1ydW4tMSIsInRlbmFudF9pZCI6ImFnZW5jeS10ZW5hbnQiLCJ3b3JrbG9hZF9zcGlmZmVfaWQiOiJzcGlmZmU6Ly9leGFtcGxlLmdvdi93b3JrbG9hZC9hZ2VudC1hIn0sImludGVudF9zaGEyNTYiOiJlMDllNTlkNDQ4ZDc2MTg4YTIyMjE0OGQwMGRjN2VlOTczNWM0MDU2MzZiNjI0M2M1NGJjYzk0YjUxYzFlZTZkIiwidHJhbnNhY3Rpb25faWQiOiJ0eC0wNCJ9fSx7ImNhc2VfaWQiOiJjYXNlLTAwMDUiLCJzZXF1ZW5jZSI6NSwidHJhbnNhY3Rpb24iOnsiYXBwcm92YWxzIjpbeyJhcHByb3ZhbF9pZCI6ImFwcHJvdmFsLTA1IiwiYXBwcm92ZXJfaWQiOiJhcHByb3Zlci1vcGVyYXRvciIsImFwcHJvdmVyX3JvbGUiOiJvcGVyYXRvciIsImRlY2lzaW9uIjoiYXBwcm92ZSIsImV4cGlyZXNfYXQiOiIyMDI2LTA5LTA1VDE1OjA4OjEwWiIsImludGVudF9zaGEyNTYiOiIwMDAwMDAwMDAwMDAwMDAwMDAwMDAwMDAwMDAwMDAwMDAwMDAwMDAwMDAwMDAwMDAwMDAwMDAwMDAwMDAwMDAwIiwiaXNzdWVkX2F0IjoiMjAyNi0wOS0wNVQxNTowNDoxMFoiLCJub25jZSI6ImFwcHJvdmFsLTA1LW5vbmNlIn1dLCJkZWNpZGVkX2F0IjoiMjAyNi0wOS0wNVQxNTowNDoyMFoiLCJpbnRlbnQiOnsiYWN0aW9uIjoiYXBwbHktY2hhbmdlIiwiYWdlbnRfaWQiOiJhZ2VudC1hIiwiaW1wYWN0X3VuaXRzIjo1LCJpbnRlbnRfaWQiOiJpbnRlbnQtMDUiLCJpbnRlbnRfbm9uY2UiOiJpbnRlbnQtbm9uY2UtMDUiLCJwb2xpY3lfaWQiOiJzdGFuZGFyZC1jaGFuZ2UiLCJwcm9wb3NlZF9hdCI6IjIwMjYtMDktMDVUMTU6MDQ6MDBaIiwicmVxdWVzdGVyX2lkIjoicmVxdWVzdGVyLWEiLCJyZXNvdXJjZV9pZCI6InN5bnRoZXRpYy1yZXNvdXJjZS0wNSIsInJ1bl9pZCI6Im1hbmRhdGUtY29uZm9ybWFuY2UtcnVuLTEiLCJ0ZW5hbnRfaWQiOiJhZ2VuY3ktdGVuYW50Iiwid29ya2xvYWRfc3BpZmZlX2lkIjoic3BpZmZlOi8vZXhhbXBsZS5nb3Yvd29ya2xvYWQvYWdlbnQtYSJ9LCJpbnRlbnRfc2hhMjU2IjoiNWQ1YzJhYmIyNzM2MzM1YmUzZTU1OTJkYjI4MTZkZDRkYTcxMjExZTkzMTA0ZjFiNDUwMjdiZTZiMGZlYzdhMyIsInRyYW5zYWN0aW9uX2lkIjoidHgtMDUifX0seyJjYXNlX2lkIjoiY2FzZS0wMDA2Iiwic2VxdWVuY2UiOjYsInRyYW5zYWN0aW9uIjp7ImFwcHJvdmFscyI6W3siYXBwcm92YWxfaWQiOiJhcHByb3ZhbC0wNiIsImFwcHJvdmVyX2lkIjoiYXBwcm92ZXItb3BlcmF0b3IiLCJhcHByb3Zlcl9yb2xlIjoib3BlcmF0b3IiLCJkZWNpc2lvbiI6ImFwcHJvdmUiLCJleHBpcmVzX2F0IjoiMjAyNi0wOS0wNVQxNTowNToxNVoiLCJpbnRlbnRfc2hhMjU2IjoiZmI0NDBhZTY0MjM0YWE5NDYxODM2ZTg0ZWMwODQzZTI5MjlhZGE5YTk2ZWE5YmI0ZWNhZjdjMTQyOTU0YTliYyIsImlzc3VlZF9hdCI6IjIwMjYtMDktMDVUMTU6MDU6MTBaIiwibm9uY2UiOiJhcHByb3ZhbC0wNi1ub25jZSJ9XSwiZGVjaWRlZF9hdCI6IjIwMjYtMDktMDVUMTU6MDU6MjBaIiwiaW50ZW50Ijp7ImFjdGlvbiI6ImFwcGx5LWNoYW5nZSIsImFnZW50X2lkIjoiYWdlbnQtYSIsImltcGFjdF91bml0cyI6NSwiaW50ZW50X2lkIjoiaW50ZW50LTA2IiwiaW50ZW50X25vbmNlIjoiaW50ZW50LW5vbmNlLTA2IiwicG9saWN5X2lkIjoic3RhbmRhcmQtY2hhbmdlIiwicHJvcG9zZWRfYXQiOiIyMDI2LTA5LTA1VDE1OjA1OjAwWiIsInJlcXVlc3Rlcl9pZCI6InJlcXVlc3Rlci1hIiwicmVzb3VyY2VfaWQiOiJzeW50aGV0aWMtcmVzb3VyY2UtMDYiLCJydW5faWQiOiJtYW5kYXRlLWNvbmZvcm1hbmNlLXJ1bi0xIiwidGVuYW50X2lkIjoiYWdlbmN5LXRlbmFudCIsIndvcmtsb2FkX3NwaWZmZV9pZCI6InNwaWZmZTovL2V4YW1wbGUuZ292L3dvcmtsb2FkL2FnZW50LWEifSwiaW50ZW50X3NoYTI1NiI6ImZiNDQwYWU2NDIzNGFhOTQ2MTgzNmU4NGVjMDg0M2UyOTI5YWRhOWE5NmVhOWJiNGVjYWY3YzE0Mjk1NGE5YmMiLCJ0cmFuc2FjdGlvbl9pZCI6InR4LTA2In19LHsiY2FzZV9pZCI6ImNhc2UtMDAwNyIsInNlcXVlbmNlIjo3LCJ0cmFuc2FjdGlvbiI6eyJhcHByb3ZhbHMiOlt7ImFwcHJvdmFsX2lkIjoiYXBwcm92YWwtMDEiLCJhcHByb3Zlcl9pZCI6ImFwcHJvdmVyLW9wZXJhdG9yIiwiYXBwcm92ZXJfcm9sZSI6Im9wZXJhdG9yIiwiZGVjaXNpb24iOiJhcHByb3ZlIiwiZXhwaXJlc19hdCI6IjIwMjYtMDktMDVUMTU6MDQ6MTBaIiwiaW50ZW50X3NoYTI1NiI6IjMyYmEwOWE1NWQ5ZTNjMTMyOWY4ZmRlZjNhY2Q3ZmQ5ODU1ZGRlNDllYzRjY2UwODRjZjlkOGM2MjcxZjI3N2YiLCJpc3N1ZWRfYXQiOiIyMDI2LTA5LTA1VDE1OjAwOjEwWiIsIm5vbmNlIjoiYXBwcm92YWwtMDEtbm9uY2UifV0sImRlY2lkZWRfYXQiOiIyMDI2LTA5LTA1VDE1OjA2OjIwWiIsImludGVudCI6eyJhY3Rpb24iOiJhcHBseS1jaGFuZ2UiLCJhZ2VudF9pZCI6ImFnZW50LWEiLCJpbXBhY3RfdW5pdHMiOjUsImludGVudF9pZCI6ImludGVudC0wNyIsImludGVudF9ub25jZSI6ImludGVudC1ub25jZS0wNyIsInBvbGljeV9pZCI6InN0YW5kYXJkLWNoYW5nZSIsInByb3Bvc2VkX2F0IjoiMjAyNi0wOS0wNVQxNTowNjowMFoiLCJyZXF1ZXN0ZXJfaWQiOiJyZXF1ZXN0ZXItYSIsInJlc291cmNlX2lkIjoic3ludGhldGljLXJlc291cmNlLTA3IiwicnVuX2lkIjoibWFuZGF0ZS1jb25mb3JtYW5jZS1ydW4tMSIsInRlbmFudF9pZCI6ImFnZW5jeS10ZW5hbnQiLCJ3b3JrbG9hZF9zcGlmZmVfaWQiOiJzcGlmZmU6Ly9leGFtcGxlLmdvdi93b3JrbG9hZC9hZ2VudC1hIn0sImludGVudF9zaGEyNTYiOiIwYzlmYTk4MGE3NzIwMmZmMWU1Y2JkYWM0NGJkZDQxNGYxMjY1NGUwMTE0ZGUyZDdhZTgyODlmYjZmN2M5NDU1IiwidHJhbnNhY3Rpb25faWQiOiJ0eC0wNyJ9fSx7ImNhc2VfaWQiOiJjYXNlLTAwMDgiLCJzZXF1ZW5jZSI6OCwidHJhbnNhY3Rpb24iOnsiYXBwcm92YWxzIjpbeyJhcHByb3ZhbF9pZCI6ImFwcHJvdmFsLTA4IiwiYXBwcm92ZXJfaWQiOiJhcHByb3Zlci1taXNzaW9uIiwiYXBwcm92ZXJfcm9sZSI6Im1pc3Npb24tb3duZXIiLCJkZWNpc2lvbiI6ImFwcHJvdmUiLCJleHBpcmVzX2F0IjoiMjAyNi0wOS0wNVQxNTowODo1MFoiLCJpbnRlbnRfc2hhMjU2IjoiNDg0NmIxYzM3YzI2MGU2MDAwMjczZWZlYzIwYjlhMDI3NzdmN2I5OTBjMjNhZGUwZjQ1N2Y3MjZhZDI1ODAyYSIsImlzc3VlZF9hdCI6IjIwMjYtMDktMDVUMTU6MDc6MTBaIiwibm9uY2UiOiJhcHByb3ZhbC0wOC1ub25jZSJ9XSwiZGVjaWRlZF9hdCI6IjIwMjYtMDktMDVUMTU6MDc6MjBaIiwiaW50ZW50Ijp7ImFjdGlvbiI6ImFwcGx5LWNoYW5nZSIs